eqsafe_number,banner_colour,banner_type,date_of_incident,time_of_incident,directorate_region,main_roads_or_contractor,eqsafe_event_type,actual_consequence,potential_consequence,incident_short_description,traffic_control_related,traffic_control_notes,icam_investigation,critical_risk_profile,filepath
56820,grey,Final Notice,17th February 2026,10:45 AM,"RMO, Wheatbelt",Contractor,Injury/Illness,Moderate,Moderate,Quick-Cut Saw Strikes Worker in Face,No,,No,,upload/grey/Grey Banner Alert - Final Notice - 56820 - Concrete Saw Strikes Worker in Face - 17 February 2026.pdf
57148,grey,Final Notice,04/03/2026,12:45 PM,GSR,Main Roads,Injury/Illness,Moderate,Moderate,Shoulder injury resulting in LTI,No,,No,,upload/grey/Grey Banner Alert - Final Notice - 57148 - Shoulder injury resulting in LTI - 4 March 2026.pdf
57539,grey,Final Notice,23 March 2026,11:40 AM,RMO - Goldfields-Esperance,Main Roads,Lost Time Injury,Moderate,Moderate,Worker tripped over parking bay wheel stop bar,No,,No,,upload/grey/Grey Banner Alert - Final Notice - 57539 - Worker tripped over parking bay wheel stop bar - 23 March 2026.pdf
57801,red,Preliminary Notice,7th April 2026,12:00 PM,RMO - Kimberley,Main Roads,Procedure Breach,Moderate,Major,"Chain used for recovery of maintenance truck snaps and recoils, smashing through mesh guard and windscreen",Yes,Incident occurred during road maintenance activity (pothole repair) which requires traffic control setup,Yes,,"upload/red/Red Banner Alert - Preliminary Notice - 57801  - Chain used for recovery of maintenance truck, snaps and recoils, smashing through mesh guard and .pdf"
57872,red,Preliminary Notice,11 April 2026,6:15 AM,RMO - Mid West - Gascoyne Region,Contractor,Injury,Moderate,Moderate,Traffic Controller sustains shoulder injury slipping on roadside batter,Yes,TC was directly engaged in traffic management signage deployment - the most directly TC-related alert in the collection,Yes,,upload/red/Red Banner Alert - Preliminary Notice - 57872 - TC sustains shoulder injury slipping on roadside batter - 11 April 2026.pdf
57935,red,Preliminary Notice,15th April 2026,10:15 AM,RMO - Great Southern Region,Main Roads,Injury/Illness,Moderate,Moderate,"Worker struck on shin with sledgehammer, resulting in an LTI",No,,Yes,,"upload/red/Red Banner Alert - Preliminary Notice - 57935- Worker struck on shin with sledgehammer, resulting in a LTI- 15 April 2026.pdf"
57937,red,Preliminary Notice,15 April 2026,8:30 AM,RMO - Goldfields Esperance Region,Contractor,Damage/Loss,Moderate,Major,Truck rollover,Yes,Traffic control deployed as incident response after rollover,Yes,Vehicles and Driving,upload/red/Red Banner Alert - Preliminary Notice - 57937 - Truck rollover - 15 April 2026.pdf
